{
  "$schema": "../../../schemas/layout.schema.json",
  "manifestVersion": 1,
  "theme": "guizang-swiss",
  "tier": "backup",
  "stage": "1920x1080",
  "contracts": "../shared/layout-contracts.json",
  "legacyAliases": {"grid": "three-up"},
  "layouts": [
    {"id": "cover", "selector": ".theme-cover"},
    {"id": "section", "selector": ".theme-section"},
    {"id": "statement", "selector": ".theme-statement"},
    {"id": "split", "selector": ".theme-split"},
    {"id": "three-up", "selector": ".theme-grid"},
    {"id": "closing", "selector": ".theme-closing__layout"}
  ]
}
